kye	label	total	M_semenanjung	C_semenanjung	I_semenanjung	L_semenanjung	OA_semenanjung2	L_semenanjung2	BI_sabah	BBI_sabah	C_sabah	L_sabah	M_sarawak	IB_sarawak	BD_sarawak	OU_sarawak	C_sarawak	L_sarawak
1	LRG HANG JEBAT SS 16	60		57	3	0					57	3					57	3
2	JLN TUN TAN CHENG LOCK	648	2	640	5	1	1		2	1	640	5	2				640	6
3	JLN HANG JEBAT SS 12	244		237	7	0					237	7					237	7
4	JLN KUBU SS 12	30		30		0					30						30	
5	JLN HANG KASTURI SS 15	80		80		0					80						80	
6	JLN HANG LEKIR	95		93	2	0					93	2					93	2
