kye	label	total	M_semenanjung	C_semenanjung	I_semenanjung	L_semenanjung	OA_semenanjung2	L_semenanjung2	BI_sabah	BBI_sabah	C_sabah	L_sabah	M_sarawak	IB_sarawak	BD_sarawak	OU_sarawak	C_sarawak	L_sarawak
1	BDR SERI EHSAN	730	691	5	27	7	6	1	696	1	5	28	692	3	1		5	29
2	LABOHAN DAGANG	2619	2574	2	6	37	7	30	2574	7	2	36	2574	1			2	42
3	JLN RAN DESA USAHA	260	257			3	2	1	259			1	257	1				2
4	KG ORG ASLI BKT TADOM	331	7	6	3	315	312	3	52	267	6	6	7				6	318
5	KG ORG ASLI MUTUS TUA	1				1	1		1									1
6	KG ORG ASLI PAYA RUMPUT	9				9	9		6	3								9
701	BALAI POLIS BDR SERI EHSAN	6	6			0			6				6					
