kye	label	total	M_semenanjung	C_semenanjung	I_semenanjung	L_semenanjung	OA_semenanjung2	L_semenanjung2	BI_sabah	BBI_sabah	C_sabah	L_sabah	M_sarawak	IB_sarawak	BD_sarawak	OU_sarawak	C_sarawak	L_sarawak
1	KG MEGAT DEWA MK AH	497	477	19		1	1		478		19		477				19	1
2	KG TOK LO MK AH	163	162	1		0			162		1		162				1	
3	KG. LAHAR KEMELING MK AH	174	173			1		1	173			1	173					1
4	KG. MEGAT DEWA MK PUTAT	742	560	177		5	2	3	558	4	177	3	560				177	5
5	KG TOK TONG	57	57			0			57				57					
701	PONDOK POLIS MEGAT DEWA	1	1			0			1				1					
