kye	label	total	M_semenanjung	C_semenanjung	I_semenanjung	L_semenanjung	OA_semenanjung2	L_semenanjung2	BI_sabah	BBI_sabah	C_sabah	L_sabah	M_sarawak	IB_sarawak	BD_sarawak	OU_sarawak	C_sarawak	L_sarawak
1	R PANJANG BANDAR BARU SENTUL	116	50	15	43	8		8	50		15	51	50				15	51
2	BANDAR BARU SENTUL	1327	516	503	296	12	5	7	520	1	503	303	517				503	307
3	R/ PANGSA B.B SENTUL (NG.SEMBILAN)	3016	1194	1011	775	36	15	21	1201	8	1011	796	1196	4	1		1011	804
4	MELUR APRT SENTUL PERDANA	176	83	53	34	6	4	2	86	1	53	36	83	2	1		53	37
5	MENARA ORCHID	446	264	122	45	15	9	6	270	3	122	51	264	1	2		122	57
