kye	label	total	M_semenanjung	C_semenanjung	I_semenanjung	L_semenanjung	OA_semenanjung2	L_semenanjung2	BI_sabah	BBI_sabah	C_sabah	L_sabah	M_sarawak	IB_sarawak	BD_sarawak	OU_sarawak	C_sarawak	L_sarawak
1	JLN JELATANG 6, TMN MEGAH RIA	3	1	2		0			1		2		1				2	
2	JLN CENDERAI TMN MEGAH RIA	903	354	234	170	145	135	10	386	103	234	180	354	100	7	1	234	207
3	FLAT JLN CENDERAI TMN MEGAH RIA	127	13	40	14	60	59	1	21	51	40	15	16	51	1		40	19
4	JLN JELATANG TMN MEGAH RIA	1478	380	937	125	36	28	8	383	25	937	133	380	19	1	1	937	140
5	FLAT JLN JELATANG TMN MEGAH RIA	45	6	29	5	5	5		6	5	29	5	6	5			29	5
6	JLN DEDARU TMN MEGAH RIA	492	126	293	49	24	20	4	130	16	293	53	126	18		1	293	54
7	JLN KEMPAS TMN MEGAH RIA	429	111	289	21	8	8		112	7	289	21	111	3		2	289	24
8	APARTMENT RIA,MEGAH RIA	91	15	54	17	5	5		16	4	54	17	15	4			54	18
801	PENGUNDI TIDAK HADIR	1		1		0					1						1	
