kye	label	total	M_semenanjung	C_semenanjung	I_semenanjung	L_semenanjung	OA_semenanjung2	L_semenanjung2	BI_sabah	BBI_sabah	C_sabah	L_sabah	M_sarawak	IB_sarawak	BD_sarawak	OU_sarawak	C_sarawak	L_sarawak
1	RH ANCHA SG MEGOW	35				35	35			35				35				
2	RH TUTONG SG TANESU MUKAH	86		3		83	83			83	3			83			3	
3	RH CHAING SG BAKAU TIRIS	19				19	19		1	18				19				
4	RH DANA SG TERIS	16				16	16			16				16				
5	RH. BANTA	13				13	13			13				13				
6	MUKAH KENYANA OIL PALM SCHEME	40		3		37	37		1	36	3			37			3	
7	RH LABAT ULU KENYANA MUKAH	15				15	15			15				15				
