kye	label	total	M_semenanjung	C_semenanjung	I_semenanjung	L_semenanjung	OA_semenanjung2	L_semenanjung2	BI_sabah	BBI_sabah	C_sabah	L_sabah	M_sarawak	IB_sarawak	BD_sarawak	OU_sarawak	C_sarawak	L_sarawak
1	BAGAN AYER ITAM MK D	4	4			0			4				4					
2	JALAN BAHRU MK D	1157	1057	93	5	2	1	1	1056	2	93	6	1057	1			93	6
3	KUALA JALAN BAHRU MK C	195	11	182		2	1	1	12		182	1	11	1			182	1
4	KUALA JALAN BAHARU MK D	522	60	458	4	0			58	2	458	4	60				458	4
5	TITI TRAS MK E	62	59	3		0			59		3		59				3	
6	SUNGEI BURONG MK D	47	46	1		0			46		1		46				1	
7	SUNGEI KOROK MK D	2	2			0			2				2					
8	TAMAN PRESTIGE 3	25	4	19	2	0			4		19	2	4				19	2
